{
  "$schema": "https://json-schema.org/draft/2020-12/schema",
  "$id": "https://fabio-ara.github.io/AraLearn/authoring/schemas/part-submission.schema.json",
  "title": "Submissão de uma parte",
  "type": "object",
  "required": ["artifact", "version", "runId", "partKey", "requestId", "mode", "attempt", "baseLedgerSha256", "fragment", "stateDelta"],
  "properties": {
    "artifact": { "const": "aralearn.part-submission" },
    "version": { "const": 1 },
    "runId": { "$ref": "common.schema.json#/$defs/uuid" },
    "partKey": { "$ref": "common.schema.json#/$defs/partKey" },
    "requestId": { "$ref": "common.schema.json#/$defs/requestId" },
    "mode": { "enum": ["build", "repair", "rebuild"] },
    "attempt": { "type": "integer", "minimum": 1 },
    "baseLedgerSha256": { "$ref": "common.schema.json#/$defs/hash" },
    "fragment": {
      "type": "object",
      "required": ["courseId", "moduleId", "lessonId", "microsequences"],
      "properties": {
        "courseId": { "$ref": "common.schema.json#/$defs/identifier" },
        "moduleId": { "$ref": "common.schema.json#/$defs/identifier" },
        "lessonId": { "$ref": "common.schema.json#/$defs/identifier" },
        "microsequences": {
          "type": "array",
          "minItems": 1,
          "items": {
            "type": "object",
            "required": ["id", "title", "goal", "role", "status", "cards"],
            "properties": {
              "id": { "$ref": "common.schema.json#/$defs/identifier" },
              "title": { "$ref": "common.schema.json#/$defs/nonEmptyText" },
              "goal": { "$ref": "common.schema.json#/$defs/nonEmptyText" },
              "role": { "enum": ["explain", "practice", "review", "support"] },
              "status": { "enum": ["generated", "needs_review", "ready"] },
              "dependsOn": { "$ref": "common.schema.json#/$defs/stringSet" },
              "covers": { "$ref": "common.schema.json#/$defs/stringSet" },
              "checks": { "$ref": "common.schema.json#/$defs/stringSet" },
              "errors": { "$ref": "common.schema.json#/$defs/stringSet" },
              "cards": {
                "type": "array",
                "minItems": 1,
                "items": {
                  "type": "object",
                  "required": ["id", "position", "resource", "kind", "exercise", "title", "after"],
                  "properties": {
                    "id": { "$ref": "common.schema.json#/$defs/identifier" },
                    "position": { "type": "integer", "minimum": 1 },
                    "resource": { "enum": ["paragraph", "choice", "composite", "code", "table", "flow", "tree", "graph", "relation_map", "matrix", "plane", "formula"] },
                    "kind": { "enum": ["theory", "exercise"] },
                    "exercise": { "enum": ["none", "gap", "choice"] },
                    "title": { "$ref": "common.schema.json#/$defs/nonEmptyText" },
                    "after": { "type": "string" }
                  },
                  "additionalProperties": true
                }
              }
            },
            "additionalProperties": false
          }
        }
      },
      "additionalProperties": false
    },
    "evidence": {
      "type": "array",
      "maxItems": 200,
      "items": {
        "type": "object",
        "required": ["sourceId"],
        "properties": {
          "sourceId": { "type": "string", "minLength": 1 },
          "claimId": { "type": "string", "minLength": 1 }
        },
        "additionalProperties": true
      }
    },
    "stateDelta": {
      "type": "object",
      "required": ["introducedTermIds", "usedClaimIds", "coveredOutcomeIds", "resolvedErrorIds", "notes"],
      "properties": {
        "introducedTermIds": {
          "type": "array",
          "maxItems": 1000,
          "uniqueItems": true,
          "items": { "type": "string", "minLength": 1, "maxLength": 500 }
        },
        "usedClaimIds": {
          "type": "array",
          "maxItems": 1000,
          "uniqueItems": true,
          "items": { "type": "string", "minLength": 1, "maxLength": 500 }
        },
        "coveredOutcomeIds": {
          "type": "array",
          "maxItems": 1000,
          "uniqueItems": true,
          "items": { "type": "string", "minLength": 1, "maxLength": 500 }
        },
        "resolvedErrorIds": {
          "type": "array",
          "maxItems": 1000,
          "uniqueItems": true,
          "items": { "type": "string", "minLength": 1, "maxLength": 500 }
        },
        "notes": {
          "type": "array",
          "maxItems": 1000,
          "uniqueItems": true,
          "items": { "type": "string", "minLength": 1, "maxLength": 500 }
        }
      },
      "additionalProperties": false
    }
  },
  "additionalProperties": false
}
