{
  "artifact": "aralearn.part-submission",
  "version": 1,
  "runId": "11111111-1111-4111-8111-111111111111",
  "partKey": "part-conjuncao",
  "requestId": "part-conjuncao-attempt-1",
  "mode": "build",
  "attempt": 1,
  "baseLedgerSha256": "aaaaaaaaaaaaaaaaaaaaaaaaaaaaaaaaaaaaaaaaaaaaaaaaaaaaaaaaaaaaaaaa",
  "fragment": {
    "courseId": "course-logica-exemplo",
    "moduleId": "module-conectivos",
    "lessonId": "lesson-conjuncao",
    "microsequences": [
      {
        "id": "micro-conjuncao",
        "title": "Regra da conjunção",
        "goal": "Explicar e reconhecer a condição de verdade.",
        "role": "explain",
        "status": "needs_review",
        "dependsOn": [],
        "covers": [
          "condição de verdade"
        ],
        "checks": [
          "reconhece o caso em que P e Q é verdadeira"
        ],
        "errors": [
          "confundir a conjunção com uma regra que aceita apenas uma proposição verdadeira"
        ],
        "cards": [
          {
            "id": "card-regra",
            "position": 1,
            "resource": "paragraph",
            "kind": "theory",
            "exercise": "none",
            "title": "Exemplo: P e Q verdadeiras",
            "text": "Considere P verdadeira e Q verdadeira. A conjunção P e Q é verdadeira, pois as duas proposições são verdadeiras.",
            "after": "A decisão usa os valores dados no próprio exemplo: verdadeira e verdadeira resultam em uma conjunção verdadeira.",
            "sources": [
              "source-material"
            ],
            "topics": [
              "conjunção"
            ]
          },
          {
            "id": "card-pratica",
            "position": 2,
            "resource": "choice",
            "kind": "exercise",
            "exercise": "choice",
            "title": "Reconheça a conjunção verdadeira",
            "question": "Em qual caso a conjunção P e Q é verdadeira?",
            "options": [
              {
                "id": "a",
                "text": "P e Q são verdadeiras."
              },
              {
                "id": "b",
                "text": "Somente P é verdadeira."
              },
              {
                "id": "c",
                "text": "Somente Q é verdadeira."
              }
            ],
            "answer": "a",
            "after": "A alternativa correta é a única em que as duas proposições são verdadeiras.",
            "sources": [
              "source-material"
            ],
            "topics": [
              "conjunção"
            ]
          }
        ]
      }
    ]
  },
  "evidence": [
    {
      "sourceId": "source-material",
      "claimId": "claim-conjuncao-verdadeira",
      "cardIds": [
        "card-regra",
        "card-pratica"
      ]
    }
  ],
  "stateDelta": {
    "introducedTermIds": [
      "term-conjuncao"
    ],
    "usedClaimIds": [
      "claim-conjuncao-verdadeira"
    ],
    "coveredOutcomeIds": [
      "outcome-conjuncao"
    ],
    "resolvedErrorIds": [
      "confundir a conjunção com uma regra que aceita apenas uma proposição verdadeira"
    ],
    "notes": [
      "A prática contrasta os dois casos de apenas uma proposição verdadeira."
    ]
  }
}
